{
  "attempt": 1,
  "build_id": "safehavenrr-1786876760654",
  "client_id": "safehavenrr",
  "completed_at": "2026-08-16T10:39:20.691Z",
  "input_digest": "4f53cda18c2baa0c0354bb5f9a3ecbe5ed12ab4d8e11ba873c2f11161202b945",
  "input_evidence": [],
  "output_digest": "4f53cda18c2baa0c0354bb5f9a3ecbe5ed12ab4d8e11ba873c2f11161202b945",
  "output_evidence": [],
  "schema": "website-bot.stage-checkpoint/v2",
  "stage": "domain-spec-loader",
  "stage_version": "2.1.0",
  "started_at": "2026-08-16T10:39:20.686Z",
  "status": "passed"
}
