{
  "attempt": 1,
  "build_id": "safehavenrr-1786876760654",
  "client_id": "safehavenrr",
  "completed_at": "2026-08-16T10:45:08.913Z",
  "input_digest": "4945475d9b8bcc9dd8bdecbcab422e3f36fb4c050c22e8b4e4ae4b67989be54c",
  "input_evidence": [
    {
      "kind": "assembly",
      "logical_id": "safehavenrr-1786876760654:assembly",
      "relative_path": "assembly-manifest.json",
      "schema": "website-bot.assembly-manifest/v2",
      "sha256": "e47bb8d76a6e9f23451e19d162200cf3d4ee3fd4e9b6161c458e0a2741872fbd"
    }
  ],
  "output_digest": "195011f852293a133aaf9f1ec230dbd19ed2e42743135bb08b2923c1a94b5711",
  "output_evidence": [
    {
      "kind": "build",
      "logical_id": "build_2ec25daf5c34e291fb1f91646c7644f5",
      "relative_path": "build-proof.json",
      "schema": "website-bot.build-proof/v2",
      "sha256": "d504bf6b5bf059a181443d77d8c58892e93b28b7740c82046806e7b9862080a3"
    }
  ],
  "schema": "website-bot.stage-checkpoint/v2",
  "stage": "site-build",
  "stage_version": "3.0.0",
  "started_at": "2026-08-16T10:44:49.335Z",
  "status": "passed"
}
