{
  "attempt": 1,
  "build_id": "safehavenrr-1786876188151",
  "client_id": "safehavenrr",
  "completed_at": "2026-08-16T10:29:48.249Z",
  "input_digest": "4f53cda18c2baa0c0354bb5f9a3ecbe5ed12ab4d8e11ba873c2f11161202b945",
  "input_evidence": [],
  "output_digest": "4f53cda18c2baa0c0354bb5f9a3ecbe5ed12ab4d8e11ba873c2f11161202b945",
  "output_evidence": [],
  "schema": "website-bot.stage-checkpoint/v2",
  "stage": "source-site-ingestion",
  "stage_version": "2.0.0",
  "started_at": "2026-08-16T10:29:48.249Z",
  "status": "passed"
}
