{
  "attempt": 1,
  "build_id": "safehavenrr-1786865186713",
  "client_id": "safehavenrr",
  "completed_at": "2026-08-16T07:31:58.281Z",
  "input_digest": "4f53cda18c2baa0c0354bb5f9a3ecbe5ed12ab4d8e11ba873c2f11161202b945",
  "input_evidence": [],
  "output_digest": "d167ca3d28c319d3c953195137aec304e647441a5779349d11d6bb6ca1cc1e11",
  "output_evidence": [
    {
      "kind": "assembly",
      "logical_id": "safehavenrr-1786865186713:assembly",
      "relative_path": "assembly-manifest.json",
      "schema": "website-bot.assembly-manifest/v2",
      "sha256": "81408afdcf9f5301f56d97f4f4a2e8b33b070acff06ee1c8115933174387d697"
    }
  ],
  "schema": "website-bot.stage-checkpoint/v2",
  "stage": "site-assembler",
  "stage_version": "3.0.0",
  "started_at": "2026-08-16T07:31:58.226Z",
  "status": "passed"
}
